<?xml version="1.0" encoding="UTF-8"?>
<!DOCTYPE particleSystem SYSTEM "particlesDTD.dtd" >
<particleSystem>
	<emitter delay="0" duration="0" lifetimeMin="1" lifetimeMax="1.5" rate="1" initialRotMin="-3.14159" initialRotMax="3.14159">
		<texture filtered="false" src="data/particle_glow.png"/>
		<modules>
			<colorOverLife>
				<vec4 x="1" y="0" z="0" w="1" use="colorStart"/>
				<vec4 x="1" y="0.1" z="0" w="0.3" use="colorEnd"/>
			</colorOverLife>
			<sizeOverLife>
				<vec2 x=".2" y=".2" use="sizeStart"/>
				<vec2 x="0" y="0" use="sizeEnd"/>
			</sizeOverLife>
			<initialVelCone angleMin="-.2" angleMax=".2" velMin="50" velMax="75"/>
		</modules>
	</emitter>

	<!-- 
	<emitter angleMin="-.2" angleMax=".2" delay="0" duration="0" lifetimeMin="0.10" lifetimeMax=".3" rate="5" velocityMin="50" velocityMax="75" gravityScale="0">
	<basic sizeInitial=".2" sizeEnd="0"></basic>
	<texture filtered="false" src="data/particle_glow.png"/>
	<vec4 x="1" y="0" z="0" w="1" use="colorStart"/>
	<vec4 x="1" y=".1" z="0" w=".3" use="colorEnd"/>
	</emitter>
	 -->
</particleSystem>
