<?xml version="1.0" encoding="UTF-8"?>
<!DOCTYPE particleSystem SYSTEM "particlesDTD.dtd" >
<particleSystem>
	<emitter angleMin="-3.14159" angleMax="3.14159" delay="0" duration="0" lifetimeMin="1" lifetimeMax="1.2" rate="1" velocityMin="0" velocityMax="0" gravityScale="0">
	<basic sizeInitial="3" sizeEnd="21"></basic>
	<texture filtered="true" src="data/particles/flash_01.png"/>
	<vec4 x="2" y="2" z="2" w="1" use="colorStart"/>
	<vec4 x=".3" y=".05" z=".05" w="0" use="colorEnd"/>
	</emitter>

	<emitter angleMin="-3.14159" angleMax="3.14159" delay="0" duration="0" lifetimeMin="4" lifetimeMax="6" rate="35" velocityMin="15" velocityMax="40" gravityScale="3">
	<basic sizeInitial=".2" sizeEnd="0"></basic>
<!-- 	<oriented><vec2 x="10.5" y="10.15"/></oriented> -->
	<texture filtered="false" src="data/particle_glow.png"/>
	<vec4 x="2" y="1.714" z="0.290" w="1" use="colorStart"/>
	<vec4 x=".4" y=".1" z="0" w="0" use="colorEnd"/>
	</emitter>
</particleSystem>
