<?xml version="1.0" encoding="UTF-8"?>
<!DOCTYPE particleSystem SYSTEM "particlesDTD.dtd" >
<particleSystem>
	<emitter delay="0" duration="0" lifetimeMin="1" lifetimeMax="1.5" rate="1" initialRotMin="-1.57" initialRotMax="0">
		<texture filtered="false" src="data/particles/shell_01.png"/>
		<modules>
			<colorOverLife>
				<vec4 x="1" y="1" z="1" w="1" use="colorStart"/>
				<vec4 x="1" y="1" z="1" w="0" use="colorEnd"/>
			</colorOverLife>
			<sizeOverLife>
				<vec2 x=".4" y=".4" use="sizeStart"/>
				<vec2 x=".4" y=".4" use="sizeEnd"/>
			</sizeOverLife>
			<gravity gravityScale="5"/>
			<initialVelCone angleMin="-1.57" angleMax="0" velMin="8" velMax="15"/>
		</modules>
	</emitter>
	
	<!--
	<emitter angleMin="-1.57" angleMax="0" delay="0" duration="0" lifetimeMin="1" lifetimeMax="1.5" rate="1" velocityMin="8" velocityMax="15" gravityScale="5">
	<basic sizeInitial=".4" sizeEnd=".4"></basic>
	<texture filtered="false" src="data/particles/shell_01.png"/>
	<vec4 x="1" w="1" z="1" y="1" use="colorStart"/>
	<vec4 x="1" w="0" z="1" y="1" use="colorEnd"/>
	</emitter>
	-->
</particleSystem>
