<?xml version="1.0" encoding="UTF-8"?>
<!DOCTYPE particleSystem SYSTEM "particlesDTD.dtd" >
<particleSystem>
	<emitter delay="0" duration="3" lifetimeMin=".05" lifetimeMax=".1" rate="80" initialRotMin="0" initialRotMax="0">
		<texture filtered="false" src="data/particles/spark.png"/>
		<modules>
			<colorOverLife>
				<vec4 x="4" y="2" z="1" w="1" use="colorStart"/>
				<vec4 x=".9" y=".4" z=".1" w=".5" use="colorEnd"/>
			</colorOverLife>
			<sizeOverLife>
				<vec2 x=".08" y=".08" use="sizeStart"/>
				<vec2 x=".08" y=".08" use="sizeEnd"/>
			</sizeOverLife>
			<initialVelCone angleMin=".03" angleMax=".03" velMin="75" velMax="110"/>
		</modules>
	</emitter>


<!--	<emitter angleMin="1.407" angleMax="1.607" delay="0" duration="3" lifetimeMin="0.05" lifetimeMax="0.1" rate="80" velocityMin="30" velocityMax="50" gravityScale=".3">
	<basic sizeInitial=".04" sizeEnd=".04"></basic>
<!--	<oriented><vec2 x="10.5" y="10.15"/></oriented>
	<texture filtered="false" src="data/white_pixel.png"/>
	<vec4 x="1" y="0.9" z="0.7" w="1" use="colorStart"/>
	<vec4 x=".2" y="0" z="0" w="1" use="colorEnd"/>
	</emitter>-->
</particleSystem>
